text,date,link
"Dans le cadre de sa stratégie de développement de l’aquaculture marine au Maroc, l’Agence nationale pour le développement de l’aquaculture (ANDA) lance ce lundi 06 juin 2022 deux appels à manifestation d’intérêt (AMI) pour le développement de projets d’algoculture dans la lagune de la Marchica. Le premier, adressé aux investisseurs nationaux et internationaux intéressés par le développement de projets aquacoles, propose 24 parcelles de 16 ha chacune. Le deuxième, dédié aux jeunes entrepreneurs de la région de l’Oriental et aux coopératives de marins pêcheurs opérant dans la lagune de la Marchica, porte sur 5 parcelles de 16 ha chacune. Les porteurs de projets intéressés par cette activité peuvent télécharger, les dossiers des Appels à Manifestation d’Intérêt, à partir du site de l'ANDA. Ils sont invités à déposer leurs dossiers, au plus tard le 07 novembre 2022 à 16h30.",2022-06-06,https://lematin.ma/express/2022/algoculture-investisseurs-entrepreneurs-vos-projets/376667.html
"Après une conséquente augmentation de capital pour accompagner son plan de développement, le conseil d’administration de Palmeraie Holding, présidé par M. Saad Berrada Sounni, l’actionnaire majoritaire du groupe, annonce le changement de dénomination de la holding qui devient désormais « Africorp Consortium ». Ce changement marque une nouvelle étape d’institutionnalisation réussie du groupe enclenchée depuis quelques années, en un consortium de métiers avec un développement continental multisectoriels, une holding africaine avec des prises de participations majoritaires dans ses pôles d’activités. La dénomination des pôles d’activités a été aussi repensée pour une harmonisation de l’architecture globale des marques : Industrie & Distribution, via son pôle Africorp Industry ; Agriculture, via son pôle Africorp Agri ; Mines & Carrières, via son pôle Africorp Mining ; et Education, via son pôle Africorp Edu. Cette transformation répond ainsi au développement stratégique du groupe et vient affirmer davantage sa vocation africaine. Africorp Consortium a lancé en fin d’année dernière, la construction de son nouveau siège social à proximité de Casablanca Finance City. Ce dernier sera opérationnel courant le prochain trimestre.",2022-06-06,https://lematin.ma/express/2022/palmeraie-holding-devient-africorp-consortium/376660.html
"Trois mois à peine nous séparent de la prochaine rentrée scolaire et les éditeurs des livres scolaires attendent toujours le verdict officiel de la Commission interministérielle chargée de statuer sur leur dossier. Ceux-ci s’attendent à recevoir incessamment une bonne nouvelle, puisque la Commission s’est rendue à leurs arguments et aurait émis un avis favorable pour une hausse des prix des manuels homologués qui tournerait autour de 20%. Cette mesure devrait néanmoins inciter les éditeurs à appliquer la préférence nationale et à travailler avec les imprimeurs locaux. La tension est à son comble chez les éditeurs de livres scolaires, mais l’on se rapproche d’un dénouement positif. Il y aura bel et bien une révision à la hausse des prix des manuels et la décision devrait tomber d’ici la semaine prochaine. Reste à statuer sur le pourcentage de hausse qui sera appliqué. «Les éditeurs ont demandé une augmentation de 67% des prix des livres scolaires, mais cette demande a été rejetée par le ministère des Finances qui l’a jugée exorbitante», confie au «Matin» une source au sein de la Commission interministérielle en charge du dossier, composée des départements des Finances, de l’Industrie et du commerce, de l’Intérieur et de l’Éducation nationale. Selon la même source, le ministère des Finance aurait consenti 20% d’augmentation, mais la décision n’a pas encore été actée et les discussions sont toujours en cours. Pour rappel, les éditeurs des livres scolaires, acculés par l’impact de la hausse des prix des intrants sur leurs marges bénéficiaires, ont saisi le ministère de l’Éducation nationale pour une révision des prix de vente publics des ouvrages homologués, lesquels sont fixés par ledit ministère et qui sont, pour la plupart, figés pour certains depuis 2002. Suite à cette demande, une commission interministérielle a été formée pour statuer sur le sujet. Après avoir étudié les doléances des éditeurs, celle-ci a mené sa propre enquête qui a confirmé les dommages subis par les principaux concernés et démontré la nécessité de revoir la tarification à la hausse. Aujourd’hui, les éditeurs sont toujours dans l’expectative. «Nous avons eu vent des informations qui circulent, mais aucune décision officielle ne nous a été communiquée à ce jour», déclare au «Matin» Ahmed Filali Ansari, président de l’Association marocaine des éditeurs (AME). Pour lui, ces 20%, ou même un peu plus, sont loin d’être suffisants pour leur permettre de rentrer dans leurs frais et de faire un bénéfice, mais permettraient au moins d’atténuer les pertes subies. «Avec les prix de l’impression qui ont augmenté de 70 à 80%, la proposition de la Commission reste en deçà de nos espoirs. Toutefois, nos interlocuteurs nous ont demandé de faire des concessions, eu égard à la conjoncture actuelle, et cette hausse permettra au moins d’amortir l’impact des dommages», souligne le président de l’AME. Le prix du papier d’édition a plus que doublé Il fait remarquer que les prix des cahiers scolaires ont subi pour leur part une augmentation de plus de 60%. Mais contrairement aux manuels scolaires homologués, relève-t-il, «cette hausse n’a provoqué aucune contestation ou intervention de la part des pouvoirs publics, parce que la fixation des prix est libre et obéit à la loi de l’offre et de la demande». L’éditeur signale par ailleurs que, depuis janvier 2022, le prix du papier d’édition est passé de 700 à 1.520 euros la tonne, soit une augmentation de 120%, précisant que le papier d’édition provient exclusivement de l’importation et que les prix sont libellés en euros ou en dollars. Il tire encore une fois la sonnette d’alarme sur les conséquences de tout retard dans la prise de décision. «L’approvisionnement risque de connaître des perturbations à cause de la rareté du papier et du retard dans la prise de décision relative à la révision des prix publics réglementés», alerte-t-il. Interpellé sur l’impact de cette hausse sur les finances des parents d’élèves, Ahmed Filali Ansari a tenu à rappeler que l’opération «Un million de cartables», qui concerne en fait 4,5 millions d’élèves des écoles publiques, acquiert 80% des livres homologués dans le cadre de l’INDH. De ce fait, estimet-il, seuls 20% des élèves des écoles privées subiront «une augmentation probable». «Notre objectif principal est d’assurer l’approvisionnement du marché pour la prochaine rentrée. Les prix actuels sont intenables», insiste-t-il. De leur côté, les imprimeurs, tout en reconnaissant la légitimité de la demande des éditeurs de réviser le prix public de vente des livres scolaires, s’attendent à ce que ceux-ci jouent le jeu en faisant prévaloir la préférence nationale que le gouvernement leur avait notifiée en mars 2021. C’est d’ailleurs l’esprit d’une lettre adressée par le Groupement Marocain des métiers de l’Impression (GMI) le 3 juin 2022 au président de l’AME. Pour rappel, la décision de mars 2021 venait en réponse aux doléances des acteurs du secteur de l’imprimerie qui dénonçaient le recours de certains éditeurs de livres scolaires, à l’impression de plusieurs millions d’exemplaires de manuels scolaires à l’étranger.",2022-06-05,https://lematin.ma/express/2022/augmentation-prix-livres-scolaires-verdict-d-semaine-prochaine-editeurs-appliqueront-preference-nationale/376650.html
"Le Maroc jouit d’une attractivité «sans précédent» pour les capitaux industriels étrangers et nationaux. C’est une réalité confirmée ces derniers jours par plusieurs annonces d’investissement d’envergure. C’est une réalité d’autant plus confortante pour la relance industrielle qu’elle s’inscrit dans deux thématiques pertinentes : l’intégration de la chaîne de valeur mondiale, notamment dans le domaine de l’industrie décarbonnée et la mobilité propre et, dans un second lieu, la promotion du «Made in Morocco» et donc de la substitution de la production nationale aux importations. Cette évolution est, évidemment, l’une des conséquences directes de la mise en œuvre du Plan d’accélération industrielle. Cette stratégie a permis au Maroc de se positionner sur la carte industrielle mondiale. Grâce à ce plan ainsi qu’au plan de relance industrielle, le Royaume s’est, en effet, démarqué au niveau international. Par ailleurs, comme l’a d’ailleurs souligné récemment le ministre de l’industrie et du commerce, une stratégie industrielle à long terme est en cours d’élaboration, tenant compte des recommandations du Nouveau modèle de développement. Pour ce faire, l’ensemble des départements ministériels concernés sont mobilisés pour soutenir l’industrie nationale. Pour commencer, un nouveau décret relatif aux marchés publics visant à encourager le produit national est actuellement en phase d’élaboration. Pour le reste, le nombre de projets déposés dans le cadre de la «Banque à projets» s’est élevé à 1 065. Ces projets, d’une enveloppe budgétaire de 42 MMDH, et d’un chiffre d’affaires prévu de plus de 120 MMDH, permettront la création d’environ 250 000 emplois directs et indirects. Évidemment, il ne s’agit pas de projets sur papier. Ces projets sont, en effet, en phase de mise en œuvre à travers les régions du Royaume. Le Groupe Anouar Invest vient d’en donner l’exemple en annonçant plusieurs projets d’envergure, dont le coût global d’investissement est de 1 MMDH. Ainsi, dans ce contexte de relance industrielle, le groupe s’inscrit dans une dynamique de croissance en réalisant des investissements qui lui permettront d’amorcer un nouveau cycle de développement. Une orientation qui justifie aujourd’hui le lancement de différents projets par le groupe, afin d’élargir son éventail de produits inédits. Le premier concerne l’extension de son usine de production de biscuiterie Best Biscuits Maroc. L’extension, lancée lundi dernier et qui mise sur la biscuiterie et le snacking, traduit la volonté du groupe de répondre à une demande tant nationale qu’internationale. Représentant un investissement total de 350 MDH, lequel sera déployé en 3 phases à l’horizon 2024, cette extension va permettre à terme la création de 700 emplois directs. Le groupe envisage par là le développement d’une offre innovante, diversifiée et parfaitement en mesure de rivaliser avec les produits d’importation. D’autres chantiers ont été initiés cette année pour un investissement total de 652 MDH. Ils concernent les marchés de la chocolaterie, avec Golden Chocolate lancé pour un investissement de100 MDH et 150 emplois à la clé, de la fromagerie avec Modern Cheese Farm et Universal Cheese Company, soit 152 MDH d’investissement et 179 emplois prévus, et de la levure boulangère, avec American Yeast Company qui représente 400 MDH et permettra de créer 250 emplois. En somme, les filières précitées, ainsi que l’unité de production constituent un investissement global de 1 MMDH. Des investissements qui rentrent à la fois dans le cadre de la promotion du Made in Morocco et de la politique de substitution aux importations avec, il ne faut pas l’oublier, ce que cette politique présente également en potentiel d’exportation. La même semaine, c’est le géant mondial des semi-conducteurs qui a inauguré à Bouskoura sa nouvelle ligne de production de composants électroniques. Ce projet s’inscrit en droite ligne avec le partenariat conclu, il y a quelques jours, entre le groupe minier Managem et le constructeur automobile mondial Renault. Ce dernier projet, rappelons-le , porte sur la création d’une unité de fabrication du sulfate du cobalt. Les 5 000 tonnes de ce produit fourni par Managem, à compter de 2025, servira à produire 300 000 batteries destinées à autant de véhicules électriques. La nouvelle ligne de production de composants électroniques de STMicroelectronics (ST) qui a été inaugurée, mardi sur son site à Bouskoura, est également destinée à fournir en composant les voitures électriques. Avec un investissement de 2,4 MMDH, ce projet d’extension de ST, qui comprend un élargissement de la surface de production d’une superficie de 7 500 m², permettra d’assurer une augmentation majeure de la capacité de production et la création de nouveaux emplois. Plus de 700 emplois, dont 100 ingénieurs, ont déjà été créés en un an et d’importants recrutements sont en cours, pour la mise en place d’une nouvelle ligne de production spécialisée dans la fabrication de produits de pointe en carbure de silicium utilisés dans les voitures électriques par les principaux constructeurs automobiles mondiaux. «C’est un véritable exploit pour l’industrie électronique nationale que nous célébrons aujourd’hui. Ce nouvel investissement de ST à Bouskoura, le 2e plus grand site du groupe au monde, survient dans un contexte mondial marqué par la pénurie de ce type de composants électroniques pour voitures électriques contraignant notamment les constructeurs automobiles à réduire leurs cadences de production», a notamment souligné à cette occasion le ministre Ryad Mezzour. Il permettra au Maroc de renforcer son positionnement dans la chaîne de valeur du secteur automobile, en tant que destination privilégiée des investissements internationaux de pointe, notamment dans la mobilité électrique, et pays précurseur dans l’industrie électronique. En produisant des composants électroniques compétitifs d’une qualité de classe mondiale conçus par des compétences majoritairement marocaines, le Maroc avance à pas de géant vers la concrétisation de sa souveraineté industrielle et confirme son énorme potentiel de développement répondant aux nouveaux besoins émergents tels que la voiture électrique, la 5G, les objets connectés ou l’Industrie 4.0. D’où justement l’importance du développement de ST Bouskoura pour la croissance future de STMicroelectronics et son leadership mondial dans les produits dédiés à l’électrification des véhicules et à la transformation numérique des entreprises industrielles. Il faut juste souligner que ST Bouskoura est l’un des principaux sites de Groupe STMicroelectronics pour l’assemblage et le test de ses produits STPOWER de pointe en carbure de silicium en grands volumes, des produits intégrés dans les véhicules électriques des principaux constructeurs automobiles mondiaux, notamment dans l’onduleur de traction principal et le chargeur embarqué, ainsi que dans l’infrastructure de charge.",2022-06-11,https://www.lavieeco.com/economie/dynamique-economique-linvestissement-industriel-repart-et-de-plus-belle/
"Depuis la crise financière de 2008, la confiance en soi, la collaboration et la joie au travail sont devenues des sujets extrêmement populaires. Emerveillés par l’énergie positive des employés de la Silicon Valley, de nombreux PDG y ont trouvé inspiration pour insuffler la magie de l’expérience collaborateur dans leurs organisations. Elle renvoie au vécu d’un collaborateur au sein de l’entreprise dans les moments clés de son parcours, depuis son recrutement jusqu’à son départ. Avec l’avènement de l’ère digitale et la transformation des modes de travail suivant la crise sanitaire, les entreprises se voient désormais dans l’obligation d’ajuster rapidement leurs modèles d’expérience collaborateur. Celles qui n’ont pas réussi ce pari ont vu leurs salariés rentrer dans un état de souffrance psychologique avec des conditions de travail dégradées. Un sentiment d’exclusion et de manque d’information était dominant et a causé un ralentissement de la performance des employés. Nous avons mené une recherche au Maroc et en France pour accompagner les entreprises dans la digitalisation désormais inéluctable, mais jonchée d’obstacles, de l’expérience collaborateur. Un procédé de transformation a été établi tenant compte des activités et moments propices à la digitalisation pour le contexte et les capacités de l’organisation et de l’employé. L’expérience collaborateur en quatre points de contacts digitalisés En fonction du niveau de maturité digital idéal, l’entreprise digitalise, à un certain degré, quatre points de contacts caractérisant l’expérience collaborateur : • Relations avec les RH : Elles comprennent trois composants, nommément l’intégration de l’entreprise, l’administration, et le développement du personnel. La digitalisation du premier implique le dépôt d’offres d’emplois sur les réseaux sociaux et sites dédiés, suivi de l’utilisation d’une plateforme de gestion des candidatures, d’entretiens vidéo, usage de la réalité virtuelle pour la découverte des locaux, et intégration de l’intelligence artificielle pour filtrer les candidats. L’administration digitale du personnel nécessite la mise en place de systèmes d’information pour la gestion du temps, et la génération et l’échange de documents. Enfin, la nature désormais numérisée des connaissances induit un ajustement des méthodes de formation en mettant en place des programmes distantiels synchrones et asynchrones. Il s’agit de programmes développés en interne, voire acquis auprès de plateformes spécialisées, et se présentent sous forme de SPOC, MOOC ou de jeux permettant au collaborateur de se former à son rythme selon ses besoins. Les entreprises qui ont adhéré à ces changements ont gagné du temps en automatisant les tâches chronophages. • Convivialité : Les participants ont souligné que les discussions autour de la machine à café et dans l’espace de détente leur ont manqué plus que leur espace personnel en période Covid. Ils viennent désormais au bureau pour créer du lien social plus que pour travailler sur leurs tâches individuelles. La digitalisation de la convivialité permet une modularité optimale de l’espace pour favoriser les échanges et les rencontres. Les lieux de détente, les évènements et les activités de team building sont partiellement, voire complètement digitalisés en intégrant des serious games, des avatars, la réalité étendue, ou le digital twin de l’organisation. Cette approche a permis aux entreprises de l’étude de rallier le physique au virtuel dans une perspective flexible aux capacités et préférences de leurs salariés. • Communications interne et externe : La digitalisation de la communication a été bénéfique aux entreprises qui l’ont mise en place de façon inclusive et pertinente. Un usage excessif des outils de communication numérique a généré du technostress et de l’infobésité, créé une démotivation de certains salariés et a favorisé leur isolement. Pour le flux interne, la digitalisation de la communication nécessite l’usage d’outils ergonomiques de mailing et d’intranet pour un partage centralisé et standardisé d’informations. Ensuite, des réseaux sociaux internes permettent des échanges ludiques et dynamiques, en intégrant un mur blanc ou une boîte à idées digitalisés. Si la digitalisation de la communication externe est orientée surtout vers les clients, le collaborateur est sollicité dans les entreprises les plus matures pour conforter leurs images en tant qu’ambassadeur sur les réseaux sociaux. Il s’agit de l’employee advocacy qui consiste à ce que les employés partagent leurs vécus et impressions à propos de l’employeur dans leurs propres comptes média ou dans des supports dédiés au branding des entreprises. • Travail du quotidien : La plupart des organisations participantes ont profité des conditions de travail dématérialisé causées par le Covid pour réaménager leurs bureaux et initier une transformation radicale des processus et outils. Les bureaux fixes et unipersonnels disparaissent au profit de salles de coworking et de postes standardisés pour accueillir tout type de collaborateur. Le nombre de postes diminue en raison du recours massif au télétravail rotatif, réduisant ainsi les coûts d’infrastructure. Les entreprises peuvent également investir dans des salles de réunion en améliorant l’acoustique en raison de la multiplication des réunions en ligne. Ces salles intègrent aussi des outils pour le brainstorming et la cocréation phygitaux. Le travail quotidien du collaborateur repose sur des interactions avec le management et les fonctions support. Des outils collaboratifs de planification et de gestion de projet et des systèmes d’échange avec les clients sont mis en place, complétant la workplace digitale. Processus de mise en place de l’expérience collaborateur digitalisée Nous avons défini un procédé de digitalisation de l’expérience collaborateur en 3 phases : • La phase d’écoute détermine le modèle digital optimal pour chaque point de contact en fonction du contexte de l’entreprise. L’organisation se fait accompagner d’experts en digitalisation pour réussir cette étape cruciale et s’assurer du respect des règlements en vigueur pour la gestion des données personnelles. L’écoute repose sur des enquêtes internes et du benchmarking externe tenant compte de la stratégie globale de l’organisation, la culture et la mentalité dominantes parmi ses équipes, et ses capacités technologiques actuelles et potentielles. Les managers d’équipes et représentants des utilisateurs sont impliqués pour intégrer les besoins de chaque unité. • Une fois le parc technologique ajusté aux modèles définis pour les points de contacts digitalisés, la confrontation permet à chaque collaborateur d’évaluer, à travers un outil self-service, sa maturité au regard des nouveaux outils et processus. L’évaluation se concentre sur les technologies et pratiques qui concernent le collaborateur, définies dans la phase précédente. Elle peut intégrer d’autres outils plébiscités par le collaborateur s’ils n’altèrent pas son travail et celui de l’équipe. • La phase de projection permet de définir et mettre en place les actions nécessaires au déploiement de l’expérience collaborateur digitalisée. En fonction de ses résultats, le collaborateur obtient des recommandations individuelles instantanées et un plan d’accompagnement pour monter en maturité. Un tableau de bord généré automatiquement permet d’observer les résultats par équipe et d’en déduire des plans de conduite de changement collectif adapté. La digitalisation de l’expérience collaborateur est un processus itératif à la lumière des évolutions des technologies, des besoins organisationnels, et du contexte socioéconomique. La maturité digitale au sein de l’entreprise doit être capturée régulièrement pour identifier les transformations d’envergure à mener, tracer la feuille de route moyen-terme de la stratégie digitale, et définir sa déclinaison en fonction des priorités des métiers.",2022-06-11,https://www.lavieeco.com/economie/la-maturite-digitale-un-levier-damelioration-de-lexperience-collaborateur/
