text,date,link
"Comment nourrir la ville et en faire un lieu durable face à une démographie exponentielle et une urbanisation qui ne cesse de s’étaler ? C’est la question qui était au cœur du débat la semaine dernière à l’Institut français d’Agadir dans le cadre du programme «Demain, dès aujourd’hui», avec pour thématique centrale cette année «la ville durable». Pour la sociologue Fettouma Djerrari Benabdenbi qui animait le débat sur le sujet, les défis à relever sont nombreux pour y arriver. Outre le logement, les transports, l’accès aux soins, le besoin en alimentation est aussi important et croissant. La crise sanitaire que le monde a vécue et le contexte actuel de flambée des coûts du carburant, engendrant une envolée des prix du transport et de la logistique, confirment aujourd’hui pleinement l’intérêt de réintroduire l’agriculture dans nos villes. «Il faut se rapprocher de l’activité agricole», souligne la conférencière. Au Maroc, l’agriculture urbaine n’est pas nouvelle. Par le passé, dans les riads comme dans les maisons traditionnelles dans les quartiers périurbains, l’activité agricole était pratiquée. Aujourd’hui encore, dans les quartiers populaires, nombreux sont les habitants qui continuent à élever notamment la volaille. C’est dire que, le concept n’est pas récent, mais avec le développement des logements en copropriété cette pratique s’est perdue. L’exemple de la Havane, où pendant longtemps 60% des produits maraîchers provenaient des terrasses des maisons, prouve que l’agriculture urbaine à petite échelle avec de petits moyens est possible et peut être une réussite. Il reste cependant à sensibiliser les populations à multiplier les microfermes et potagers urbains et péri-urbains. Pour encourager les populations à s’y intéresser, des moyens de soutien et d’encadrement sont à mettre en place. Pour l’heure, l’Agence urbaine de Taroudant-Tiznit-Tata s’intéresse à la promotion de l’agriculture urbaine dans la ville de Tiznit. Une étude a été initiée fin 2019 pour l’analyse de l’état des lieux et les différentes composantes du tissu de la palmeraie de Targa située en plein cœur de la ville de Tiznit. Etendue sur près de 530 ha, la palmeraie de Targa est localisée au nord de la Médina. Dans la région, cette palmeraie présente un patrimoine écologique et agricole de valeur caractérisé par ses potentialités économiques et son rayonnement historique, elle est intimement liée à l’histoire et l’évolution de la Médina de Tiznit. Dans le cadre de l’étude menée, il s’agit de définir les défis et enjeux sur lesquels se basera la conception des projets d’agriculture urbaine. En outre, la démarche vise à travers un benchmark international de dégager les meilleures pratiques en la matière. L’étude permettra enfin d’identifier les sites d’accueil des projets d’agriculture urbaine, et d’établir les plans d’action de promotion et de développement de ce projet. Pour le patrimoine écologique de Targa, le projet pilote offrira l’opportunité de le repenser comme partie intégrante d’une agglomération de taille moyenne en forte croissance démographique et urbanistique. Aussi, le développement de l’agriculture urbaine en ce site permettra de lutter contre l’étalement urbain et préserver ses ressources naturelles. In fine, le projet sera un exemple de changement structurel dans le développement de nos villes. Un modèle parmi les initiatives privées prises ailleurs en la matière pour impulser des méthodes nouvelles pour nourrir les populations et vivre autrement. En attendant, soulignons que lors de l’établissement de l’étude le cabinet en charge de l’opération a mené plusieurs ateliers et réunions de concertation, en partenariat avec les différents acteurs locaux et les associations de la société civile, et ce, afin de mettre en lumière les besoins réels et les enjeux locaux mais aussi de disposer d’une connaissance approfondie du territoire. Il s’agissait aussi d’identifier les politiques publiques menées en la matière. Dans le cadre de la démarche, l’Agence urbaine de Taroudant-Tiznit-Tata dit avoir veillé jusqu’à présent durant les phases franchies de l’étude sur l’organisation et la programmation des ateliers participatifs. Les personnes ressources et les différents intervenants dans la planification, l’aménagement et la gestion urbaine tels que les départements ministériels concernés, les autorités locales et la commune de Tiznit ont été associés à l’opération. Objectif: réunir tous les acteurs concernés autour d’un projet de développement durable qui se veut être réalisé pour et par les parties prenantes du territoire par la construction d’une vision commune de son évolution à moyen et à long terme, est-il indiqué dans une note d’information de l’agence. Les différentes étapes réalisées de l’étude ont permis pour le moment de dégager des projets d’agriculture urbaine accompagnés d’un plan d’action précisant les modalités opérationnelles pour la mise en œuvre desdits projets. A terme, ils devraient être des locomotives de développement local.",2022-06-05,https://www.lavieeco.com/economie/agriculture-urbaine-un-projet-pilote-de-530-ha-a-letude-a-tiznit/
"Le dossier de la réforme des régimes de retraite, qui s’inscrit dans le cadre du grand chantier de généralisation de la protection sociale, fait face à un double défi : combler le déficit et éviter la faillite des caisses, d’une part, et garantir la pérennité de ses équilibres financiers, d’autre part. Cette situation critique des régimes de retraite au Maroc a été évoquée récemment par le gouvernement et a fait l’objet de plusieurs rapports soumis par des institutions nationales dans lesquels elles font état de difficultés accrues, liées à leur pérennité et à leur équilibre financier. Il s’agit de tirer la sonnette d’alarme et d’appeler à prendre des mesures urgentes au lieu de se limiter à des solutions conjoncturelles qui n’assurent pas la pérennité du financement des caisses de retraite. Dans ce sens, et à la lumière des conclusions de l’accord social et de la Charte nationale du dialogue social, signés le 30 avril dernier par le gouvernement, la CGEM et les centrales syndicales les plus représentatives, l’Exécutif vise à lancer un dialogue ouvert avec les différents partenaires sociaux pour mettre en œuvre une réforme globale des régimes de retraite. Le gouvernement a reconnu, par le biais de la ministre de l’économie et des finances, Nadia Fettah Alaoui, la situation difficile que connaissent les régimes de retraite. La ministre a ainsi déploré, lors d’une récente intervention à la Chambre des conseillers, l’absence d’une vision cohérente du secteur, estimant qu’il y a un écart entre les cadres institutionnels des régimes, leur gouvernance et leur mode de gestion, outre les disparités entre les régimes en raison de l’absence de l’équité entre les adhérents et la faiblesse du taux de couverture. Deux chiffres ont été dévoilés par la responsable pour démontrer la fragilité des équilibres financiers: la date du début du déficit global selon les caisses entre 2015 et 2023 et la date d’épuisement des réserves entre 2028 et 2044. Elle a rappelé, à cet égard, les recommandations de la commission spéciale dédiée à la réforme qui a estimé que la mise en place de deux pôles de retraite est le cadre général de la réforme, outre l’élargissement de la couverture sociale et l’inclusion de la réforme paramétrique des régimes de pensions civiles dans le cadre du dialogue social, sans oublier la réforme paramétrique lancée en 2016. Selon elle, ces mesures restent toutefois insuffisantes pour instaurer une réforme globale des régimes de retraite. La ministre a ainsi souligné la nécessité de généraliser la retraite à l’ensemble des Marocains, conformément aux Hautes orientations royales, dans le cadre du grand chantier de la protection sociale, qui sera abordé après achèvement de celui relatif à la couverture sanitaire, faisant observer que le système de retraite est composé de différentes caisses disposant aujourd’hui de 4 millions de personnes qui y contribuent et de 1,4 million qui en bénéficient. Nadia Fettah Alaoui a, en outre, souligné la disposition de son département à ouvrir ce dossier, notant que des études techniques ont été réalisées avec des experts et responsables de la gestion des caisses de retraite, outre la tenue d’une série de réunions avec les différents partenaires concernés. Syndicats : Oui à la réforme… mais pas au détriment des salariés Le secrétaire général de l’Union marocaine du travail (UMT), Miloudi Moukharik, a accueilli avec satisfaction l’approche du gouvernement appelant les partenaires sociaux à s’asseoir à la table des négociations, faisant observer que la réforme paramétrique ne doit pas se faire au détriment des salariés qui paient régulièrement leurs cotisations. «Les fonctionnaires n’ont aucune responsabilité de la faillite que va connaître la CMR et les autres caisses de retraite», a souligné M. Moukharik, affirmant qu’ils ont payé leurs cotisations alors que l’Etat, depuis 1960 et jusqu’en 2003, n’a pas payé sa part de cotisation (part patronale). Le problème des caisses de retraite est un problème de gouvernance des épargnes des salariés et des fonctionnaires, a-t-il dit, estimant qu’ils ne doivent pas subir les conséquences de la mauvaise gestion de ces caisses. L’UMT est pour la pérennité des caisses de retraites, notamment la CMR à laquelle adhèrent les fonctionnaires, a-t-il dit, notant que la réforme ne doit pas être aux dépens de cette catégorie sociale. L’ancien gouvernement n’a pas mené une véritable réforme, puisque la situation de la caisse est la même, a-t-il déploré. Même son de cloche chez Abdellah Hssaein, du bureau exécutif de l’UGTM, qui rappelle que l’ancien gouvernement a adopté une approche unilatérale en augmentant les prélèvements, ce qui a constitué une charge pour les fonctionnaires, relevant que la réforme menée était partielle et n’a concerné que les pensions civiles à la CMR. Le problème a commencé durant les années 1990, a-t-il dit, notant que l’UGTM a été le premier syndicat a appeler à la réforme après que des études ont prédit le déficit, de même que cette centrale syndicale a plaidé pour une approche globale dans ce sens. Il a, en outre, salué l’initiative du gouvernement visant à associer les syndicats et les partenaires sociaux à la réforme du régime des retraites, assurant que l’UGTM est ouverte au dialogue et est disposée à contribuer à cette réforme. Parmi les mesures proposées pour entamer la réforme, M. Hssaein cite la préservation des postes d’emploi pour contribuer au financement des caisses des retraites et l’augmentation les recrutements dans le secteur public pour élargir la base des adhérents. Il propose aussi la création d’une caisse unifiée au niveau national comprenant les secteurs public et privé pour élargir la base des adhérents. Il s’agit aussi du paiement par l’État des deux tiers des cotisations contre un tiers pour le fonctionnaire, à l’instar de ce qui est en vigueur dans le secteur privé, et l’instauration de la justice sociale dans l’octroi des pensions. Il a également plaidé pour une réforme qui prône le travail décent, notant que la justice sociale ne peut être réalisée sans une pension garantissant la dignité du fonctionnaire et de l’employé. Selon lui, l’État doit être à l’écoute des revendications des centrales syndicales pour l’adoption d’un système juste des retraites. Réforme des régimes de retraite au Maroc : Etapes et rapports institutionnels Le système marocain de retraite est composé principalement de quatre caisses réparties entre le secteur public, à savoir la Caisse marocaine des retraites (CMR) et le Régime collectif d’allocation de retraites (RCAR), et le privé qui comprend la Caisse Nationale de sécurité sociale (CNSS) et la Caisse interprofessionnelle marocaine de Retraite (CIMR) qui représente un régime complémentaire ayant un caractère facultatif pour les employés du privé. En 2004, il a été procédé à la création de la commission spéciale dédiée à la réforme des régimes de retraite et après le lancement d’une étude sur le système visé, ladite commission avait préconisé en 2013 un système bipolaire public-privé et une réforme paramétrique du régime des pensions civiles en 2016, ce qui a permis de passer d’un horizon de viabilité du système de 2022 à 2027. Un rapport de la Direction du Trésor et des finances extérieures relevant du ministère de l’économie et des finances avait résumé les principales étapes de la réforme du système de retraite, à travers une mise en œuvre progressive des recommandations de la commission nationale en charge de la réforme : • Réformes paramétriques qui ont porté sur le régime des pensions civiles en 2016 et le RCAR (entamé en 2021) et dans la perspective de l’appliquer au niveau de la CNSS. • Généralisation de la couverture au profit des travailleurs non salariés entre 2023 et 2025 conformément aux Hautes orientations royales. • Réforme globale des régimes de retraite en accordant la priorité au secteur public. Rapports institutionnels : Une mise en garde pour se rattraper. Rapport de la Cour des comptes 2019-2020. Le rapport de la Cour des comptes au titre de 2019-2020 insiste sur la caractère urgent de la réforme des régimes de retraite en se basant sur les données suivantes : • Une couverture retraite globale qui reste limitée par rapport à la population active. • Un taux de couverture ne dépassant pas 42% parmi 5,4 millions de personnes à fin 2020, en dépit du progrès réalisé au niveau de la CNSS. • Multitude des régimes de retraite qui restent cloisonnés, fonctionnant avec des paramètres différents et continuant d’être régis par des règles de fonctionnement peu harmonisées. Régime des pensions civiles de la Caisse marocaine des retraites (RPC-CMR) • Malgré la réforme paramétrique de 2016 et la batterie des mesures prises, le redressement des différents indicateurs du régime n’est à escompter que sur le long terme. • Le régime sera confronté au risque de liquidité à partir de 2023. • Risque d’épuisement de ses réserves à l’horizon 2026. Régime général du Régime collectif d’allocations de retraite (RCAR) • Bien qu’il ne connaisse pas de problèmes de viabilité à court terme, le déficit technique (enregistré depuis 2004) se creusera davantage pour atteindre 6,53 MMDH sur l’horizon de projection des 60 années à venir • A partir de 2028, le régime enregistrera son premier déficit financier. Régime général de la CNSS • Un déficit technique du régime (branche long terme) dès 2029. • En l’absence de mesures de correction, les réserves seraient épuisées en 2046. Couverture retraites des travailleurs non salariés • Retard dans la mise en œuvre effective de la couverture prévue par la loi 99.15 de 2017. • Difficultés liées à la non-homogénéité de cette catégorie. • Hégémonie du secteur informel. Recommandations de la Cour des comptes : • Réforme de la gouvernance et du pilotage des régimes. • Poursuite de la révision et l’harmonisation des paramètres des régimes de retraite. • Facilitation de la convergence des régimes dans l’optique de convergence des régimes existants vers un régime cible préalablement défini. • Importance de la réforme paramétrique adoptée en 2016 par le gouvernement: impact positif sur la pérennité du système en limitant son endettement. • Accélération du rythme des réformes paramétriques. • Mise en place de solutions de financement appropriées dans le cadre d’une feuille de route globale de la réforme structurelle.",2022-06-05,https://www.lavieeco.com/economie/retraite-reforme-le-double-defi-deviter-la-faillite-et-de-garantir-une-vie-decente-aux-retraites/
"Amateurs du verre soufflé traditionnel, El Mehdi et Zineb M’Hairy ont créé en 2021 leur entreprise, Kiss’n, de distribution de verres soufflés traditionnels. «Ce verre artisanal était, il y a quelques années, connu et largement commercialisé sur le marché. Mais après la fermeture de l’unité de fabrication de Ain Sebaa à la fin des années 90, il a complètement disparu, laissant la place au verre industriel. On trouvait quelques modèles au quartier des Habbous à Casablanca ou bien à Marrakech et ils provenaient de certaines familles qui les revendaient. Notre objectif, avec le lancement de notre entreprise, est faire découvrir ce modèle aux jeunes et de permettre, aux plus âgés, de remonter le temps…», indique El Mehdi N’Hairy qui n’a pas hésité, en pleine crise sanitaire, de lancer son activité. «Pour moi, c’était la période idéale pour lancer mon business en e-commerce, puisqu’il y avait le confinement et les familles passaient beaucoup de temps ensemble et donc consommaient du thé et d’autres boissons. L’offre des verres soufflés traditionnels venait à point et leur permettait de découvrir cet article, certes ancien, mais devenu rare sur le marché». En mars 2021, au démarrage de Kissa’n, les ventes avaient atteint 3000 unités, aujourd’hui, elles vacillent entre 6 000 et 7 000 verres. Verres classiques transparents en verre recyclé bleu ou vert, verres en couleurs ou encore avec ornements dorés ou en acier inoxydable constituent l’essentiel de l’offre de la jeune entreprise qui cible une clientèle diversifiée : «Les jeunes de 30 ans qui sont installés chez eux et qui cherchent des articles de vaisselle originaux et vintage. Les personnes de 60 ans et plus qui retrouvent le verre artisanal de leur jeunesse, les Marocains résidant à l’étranger. Nous nous démarquons de l’offre du quartier des Habbous et de Marrakech qui, quant à eux, ciblent beaucoup plus les touristes», explique M. N’Hairy. Les ventes enregistrent un pic durant Ramadan et l’été Celui-ci avance que son objectif «est de permettre un large retour du verre soufflé artisanal, fabriqué de façon traditionnelle, dans des ateliers, donnant ainsi du travail et par conséquent un revenu à des milliers d’artisans, notamment des souffleurs de verre». C’est pourquoi les prix sont étudiés pour permettre à l’entreprise de se positionner par rapport à la concurrence dont les prix sont cinq à six fois plus élevés. Chez Kissa’n le prix varie entre 40 DH pour six verres transparents et 80 DH pour les verres teintés ou bien avec ornement. L’entreprise propose également des packs de 12 verres ornés à 350 DH. Un autre pack, 12 verres et théière en verre également, est commercialisé à 220 DH. C’est, selon les responsables de Kissa’n, le best-seller de la maison. Un autre pack de six verres teintés, plateau en bois et théière est proposé à 360 DH. Et pour répondre au mieux à la demande de sa clientèle, l’entreprise a diversifié sa gamme en mettant en vente des plateaux en bois peints à la main par Zineb N’Hairy, des carafes et des verres à jus, des saladiers et seront bientôt mis en vente des articles en poterie fabriqués par des artisans de Safi. Les articles en verre, quant à eux, sont fabriqués dans l’atelier de Casablanca et dans les deux ateliers de Marrakech. Chez Kissa’n on souligne que les achats sont essentiellement effectués par des jeunes qui commandent pour eux et, toujours selon les responsables de l’entreprise, aussi pour en faire cadeau à leurs parents. Le pic des ventes est enregistré pendant Ramadan et les mois de juin, juillet et août. Durant cette dernière période, les commandes proviennent essentiellement des MRE et représentent 40% des ventes annuelles. Par ailleurs, la clientèle compte aussi les cafés, restaurants et autres riads dans les villes de Marrakech, Fés, Kénitra, Rabat, Casablanca, Tanger et Settat.",2022-06-04,https://www.lavieeco.com/economie/kissan-relance-le-verre-souffle-artisanal/
"Le contrôle rapporte gros pour les services douaniers ! D’après les données de l’Administration des douanes et impôts indirects (ADII), les recettes en droits et taxes additionnels se sont élevées à plus de 5,39 MMDH en 2021, enregistrant une augmentation de 21% par rapport aux réalisations de 2020. Les recettes relatives aux redressements suite au contrôle de la valeur constituent la source principale d’alimentation de ces recettes à hauteur de 75%, indique l’ADII dans son rapport d’activité de l’exercice 2021. Les recettes générées suite au Contrôle a posteriori (CAP) ont, quant à elles, atteint 837 millions de dirhams (MDH), représentant 15,51% des recettes additionnelles en enregistrant une augmentation de 190% comparativement à 2020. Le contrôle immédiat hors contrôle de la valeur, pour sa part, a généré un montant de 415 MDH, soit 7,71% des recettes additionnelles, en augmentation de 184% par rapport à 2020. Par ailleurs, la fermeture des frontières a impacté les recettes liées au contrôle des voyageurs, qui ont poursuivi leur trend baissier pour la 2e année consécutive pour s’établir à 49 MDH, en repli de 21% par rapport à 2020 et de 64% par rapport à 2019. Ce trend haussier des recettes additionnelles est corrélé à la reprise des recettes douanières sur les deux dernières années. A fin avril, les recettes douanières nettes se sont établies à plus de 26 milliards de dirhams (MMDH), en hausse de 19,1% par rapport à leur niveau à fin avril 2021, selon la Trésorerie générale du Royaume (TGR). Ces recettes, qui comprennent les droits de douane, la taxe sur la valeur ajoutée (TVA) à l’importation et la taxe intérieure de consommation (TIC) sur les produits énergétiques, tiennent compte des remboursements, dégrèvements et restitutions fiscaux de 132 millions de dirhams (MDH), précise la TGR dans son récent bulletin mensuel de statistiques des finances publiques (BMSFP), ajoutant que les recettes douanières brutes ont été de 26,137 MMDH (+19,6%). Dans le détail, les recettes nettes des droits de douane réalisées à fin avril 2022 ont atteint près de 4,22 MMDH, en hausse de 15%, tandis que les recettes nettes provenant de la TVA à l’importation se sont établies à 16,754 MMDH, en progression de 28,9%. Pour sa part, la TVA sur les produits énergétiques a enregistré une hausse de 77,9% et celle sur les autres produits une augmentation de 20,4%. En ce qui concerne les recettes nettes de la TIC sur les produits énergétiques, elles ont diminué de 2,6% à 5,034 MMDH, compte tenu de remboursements, dégrèvements et restitutions fiscaux de 108 MDH. Force est de relever que 93% des recettes collectées sont effectuées via paiement électronique. Le document révèle également que 1,5 million de déclarations en douane sont traitées. Au niveau de l’amélioration des prestations de l’ADII, le délai de dédouanement a nettement baissé, passant à moins de 1h 47 minutes pour l’import et 48 minutes pour l’export, alors que le délai moyen de traitement des requêtes électroniques se situe à 1,7 jour. Au volet de la lutte contre la contrebande, la Douane a confisqué 152 MDH de marchandises. Par ailleurs, 137 466 voitures de tourisme ont été dédouanées. Les recettes de 2022 dépasseront les prévisions de la LF Les recettes douanières ont atteint 111,2 milliards de dirhams en 2021, soit une progression de +10,1 milliards de dirhams par rapport à 2019, selon le rapport d’activité de l’Administration des douanes et des impôts indirects. D’après l’Administration douanière, ces recettes dépasseront celles de l’année précédente et même les prévisions de la Loi de finances. En 2022, le ministère des finances tablait sur 117,7MMDH. «Nous serons largement au-delà», annonce-t-on auprès de l’ADII. Cette tendance est rendue possible grâce à plusieurs facteurs dont notamment le facteur inflation qui s’accentue en 2022 dans la mesure où la majorité des droits et taxes sont calculés sur la base des prix des produits et du coût du fret. La hausse des deux engendre une augmentation des recettes. A cela vient s’ajouter la poursuite de la reprise de la quasi-majorité des secteurs productifs, qui se matérialise par la hausse des importations, conjuguée à un effort de contrôle.",2022-06-04,https://www.lavieeco.com/economie/vers-un-nouveau-record-de-recettes-en-2022/
