text,date,link
"La société Marrakech Fine Food (MFF) vient d’inaugurer sa nouvelle unité industrielle. D’un montant d’investissement de 70 MDH, ce projet, qui fait suite à une convention d’investissement 2021-2024 signée, le 18 février 2021, entre l’Etat et la société MFF, s’inscrit dans le cadre du Contrat-Programme relatif au développement du secteur des Industries agroalimentaires (CP-IAA) et de la Banque de projets, indique un communiqué du ministère de l’Industrie et du commerce. Il porte sur la réalisation d’une unité industrielle spécialisée dans la fabrication de biscuits et de chocolat haut de gamme qui permettra la création de 80 emplois directs. Saisissant cette occasion, le ministre, Ryad Mezzour, a souligné que « le rythme des investissements dans l’agroalimentaire s’accélère et s’ouvre sur de nouveaux segments à forte valeur ajoutée. Cela renforce davantage la capacité de production, la diversification des produits à forte intégration locale et la compétitivité du secteur lui valant une renommée mondiale. Ce nouvel investissement contribuera à renforcer la souveraineté industrielle de notre pays et au développement de l’offre exportable nationale dans le secteur ». Par ailleurs, le groupe Imperium Holding, créé en 1979, cible, à travers sa filiale MFF, de nouveaux produits notamment dans les secteurs de la biscuiterie et chocolaterie haut de gamme, dans le cadre de sa stratégie de développement visant à répondre au besoin du marché et à diversifier son panel de produits haut de gamme destinés principalement à l’export. Reconnu pour être l’un des leaders mondiaux du marché des thés et infusions haut de gamme à travers sa société SITI, le groupe a réussi à construire un écosystème autour de ses activités, à travers plusieurs filiales qui couvrent toute la chaîne de valeur liée au thé et à ses dérivés, de la matière première au produit fini, en passant par l’emballage pour offrir des produits customisés correspondant à la demande des clients à l’échelle nationale et internationale.",2022-06-11,https://www.lavieeco.com/economie/industries-agroalimentaires-la-societe-marrakech-fine-food-inaugure-sa-nouvelle-unite-industrielle/
"Le directeur général de la compagnie nationale, Hamid Addou a souligné que la RAM a rétabli des routes aériennes qui ont été fermées durant la crise sanitaire et ouvert de nouvelles lignes, notant que ce programme permettra de recouvrir près de 90% du réseau couvert par la RAM en 2019. A cette occasion, M. Addou a mis en avant les mesures programmées par la RAM pour réussir le déplacement des Marocains du monde durant l’été, précisant que la compagnie assurera plus de 2,2 millions de sièges sur le continent européen qui abrite plusieurs importantes communautés de Marocains . « Quelque 437 fréquences par semaine relieront 9 aéroports marocains à 32 aéroports du continent européen », a-t-il précisé. En France, 890.000 sièges seront proposés et 400 vols seront opérés par semaine sur 28 routes aériennes reliant 9 aéroports de l’Hexagone à 8 villes du Royaume, a fait savoir le DG de la RAM, ajoutant que les lignes reliant 8 aéroports marocains à Paris (CDG et Orly) offriront, à elles seules, 121 fréquences par semaine. Sur le reste de l’Europe, 43 routes aériennes relieront 22 aéroports européens à 8 villes marocaines pour une capacité de plus de 1,3 million de sièges, a-t-il souligné, notant que la compagnie proposera ainsi 237 fréquences par semaine. Les routes aériennes où résident de grandes communautés de Marocains du Monde et qui connaissent une forte demande en été, seront renforcées, alors que les lignes reliant Casablanca à Barcelone, Bologne, Malaga, Madrid, Bruxelles, et Milan, passeront à un double vol quotidien, a-t-il fait observer. Et de relever qu’en Amérique du Nord, la compagnie nationale mobilisera près de 500.000 sièges, soit 6% de plus que l’offre proposée en été 2019, ajoutant que quelque 35 fréquences hebdomadaires seront mises en place sur les quatre routes aériennes reliant Casablanca à New York, Washington, Montréal et Miami. En Afrique, la RAM a renforcé son réseau qui passera à 25 lignes aériennes et une offre de 900.000 sièges, a fait remarquer M. Addou, notant que quelque 110 fréquences par semaine seront proposées. Ainsi, la Compagnie recouvrira progressivement le réseau dont elle disposait sur le continent avant la crise du Covid-19, a-t-il poursuivi. Au Moyen Orient, la RAM offrira 200.000 sièges, soit une hausse de 25% par rapport à l’offre de l’été 2019, a fait savoir M. Addou, précisant que 17 fréquences seront programmées sur les six routes aériennes opérées par la compagnie reliant Casablanca à Djeddah, Riyad, Médine, Le Caire, Tel Aviv et Dubaï. Et d’expliquer que la demande durant cette période dépasse largement l’offre du transport aérien, ce qui a conduit la compagnie nationale à renforcer sa flotte pour assurer un programme de vols intensif dans les meilleures conditions. A cet égard, la RAM a procédé à l’affrètement d’avions auprès de compagnies de renommée internationale, a-t-il indiqué, soulignant que le recours à ces avions est effectué selon les critères et les normes de sécurité imposés par les autorités compétentes et par Royal Air Maroc. En outre, la RAM a mobilisé ses partenaires dans l’Alliance Oneworld, où la compagnie nationale se positionne en tant qu’important membre, pour faire bénéficier les Marocains du monde de son réseau de plus de 1.000 destinations, a-t-il fait valoir, notant que ce réseau assure une forte connectivité entre les principales régions qui abritent un grand nombre des Marocains du monde et celles où se trouvent les principaux aéroports du Royaume. Compte tenu de la particularité du voyage des Marocains du monde qui préfèrent voyager en famille, un ensemble d’offres et de facilités a été mis en place pour répondre à leur requête portant sur un produit standard et durable avec un prix très convenable aux familles résidentes à l’étranger, permettant une réduction de 20% du prix global. Ce produit a été étoffé par des mesures souples au cours des étapes du voyage, tels que la gratuité de réservation des sièges rapprochés, l’enregistrement du bagage selon le poids global des membres de la famille, outre l’octroi de facilités de paiement pour les familles résidant en France, qui peuvent payer leurs billets d’avion en plusieurs tranches sur 3 à 4 mois, dans la perspective de généraliser cette mesure aux résidents des autres pays. Pour réussir ce programme, le DG de la RAM a fait état de la mobilisation de l’ensemble du personnel de la RAM ainsi que l’augmentation de l’effectif des agents dans les aéroports et toutes les stations d’exploitation, dans le but d’assurer des conditions parfaites de voyage, en assistant et en guidant les voyageurs, outre l’allocation d’importants investissements pour renforcer les équipements au niveau des aéroports.",2022-06-09,https://www.lavieeco.com/actualite-maroc/operation-marhaba-2022-la-ram-propose-6-millions-de-sieges/
"Ryanair, la première compagnie aérienne européenne, a annoncé, ce mercredi 8 juin, son programme d’hiver 2022/2023 marocain, le programme hivernal le plus important de son histoire, avec 7 nouvelles lignes vers des destinations passionnantes telles que Toulouse, Alicante et Francfort. Cela porte à 137 le nombre total de liaisons de Ryanair au départ ou à destination du Maroc pour l’hiver 2022/2023, ce qui offre aux clients encore plus d’options de voyage pour l’hiver, favorisant le tourisme entrant pendant la saison creuse, annonce la compagnie aérienne dans un communiqué. Avec 90 bases et plus de 2 500 lignes opérant dans 36 pays européens cet hiver, Ryanair continue de stimuler la reprise du trafic et de créer des emplois à travers l’Europe de manière durable avec une flotte croissante de nouveaux B737 « Gamechanger », qui consomment 16% de carburant en moins, produisent 40% d’émissions sonores en moins tout en ajoutant 4% de sièges supplémentaires. Pour célébrer l’annonce de son programme d’hiver 2022/2023, Ryanair a lancé une vente de sièges à durée limitée, avec des tarifs disponibles à partir de 219 DH sur les nouvelles lignes, pour des voyages entre octobre 2022 et janvier 2023. Pour profiter de ces fantastiques tarifs réduits, la compagnie invite ses clients à se connecter sur son site et réserver avant le vendredi 10 juin.",2022-06-08,https://www.lavieeco.com/actualite-maroc/ryanair-annonce-son-programme-dhiver-pour-le-maroc-7-nouvelles-lignes-desservant-10-aeroports/
"Au Maroc, Radisson Hotel Group compte déjà 6 hôtels en exploitation avec un total de 1375 chambres et 5 hôtels en développement. À l’horizon 2025, le groupe envisage de signer une quinzaine d’hôtels en exploitation et en développement, le tout totalisant 3000 chambres dans le royaume. Ses dernières réalisations, désormais opérationnelles, comptent les resorts d’Al Hoceima, Taghazout et Saïdia après les lancements réussis de Casablanca et Marrakech, s’ajouteront à ce portefeuille d’autres destinations qui viendront affirmer l’engagement du groupe pour un tourisme durable créateur de valeur ajoutée au Maroc et dans la région. Casablanca : Des ambitions pour les années à venir Le groupe continue son plan de croissance avec deux hôtels en construction pour consolider l’assiette hôtelière de Casablanca. Le premier hôtel est le Radisson Hotel Casablanca Gauthier La Citadelle avec un actif de 133 chambres et suites. Son ouverture concrétisera la promesse d’un cadre idéal pour les clients d’affaires et de loisirs. La deuxième ouverture est particulièrement attendue par les aficionados de l’urbanisme et de l’histoire Art Déco de Casablanca, il s’agit de la réouverture du mythique hôtel Lincoln dont la façade est classée patrimoine historique. L’hôtel comptera plus de 120 chambres réparties sur trois niveaux à côté de plusieurs espaces de co-working, de séminaires modulables, un spa, des restaurants et bars, un salon de thé, ainsi qu’un parking couvert sur deux niveaux de sous-sols. Cet édifice iconique constitue un territoire stratégique pour le groupe hôtelier qui considère Casablanca comme ville prioritaire dans la feuille de route de son développement. «Notre expansion au Maroc se veut ancrée dans la culture et le patrimoine Marocains et donne au groupe l’impulsion nécessaire à une solide croissance dans la région, tout en confortant nos ambitions pour les prochaines années et nos engagements vis-à vis de nos communautés et parties prenantes” témoigne Alban Mabille de Poncheville, Director Business Development North Africa.",2022-06-08,https://www.lavieeco.com/actualite-maroc/hotellerie-le-maroc-un-hub-strategique-vers-lafrique/
"Atténuer l’impact de la pandémie sur les professionnels du tourisme a été une priorité majeure pour Fatim-Zahra Ammor, Ministre du Tourisme, de l’Artisanat et de l’Économie Sociale et Solidaire. Doté d’une enveloppe de 2 milliards de dirhams, le plan d’urgence déployé dans ce sens, accorde une place primordiale à la mise à niveau des établissements hôteliers, indique un communiqué du ministère. 50% de l’enveloppe, soit 1 MMDH, a été dédié au soutien financier des Établissements d’hébergement touristiques (EHT) classés, désirant améliorer la qualité de leur offre de produits et services (entretien des équipements et espaces, intégration des énergies renouvelables, transformation digitale, formation, etc.). Ainsi, les hôteliers se verront bénéficier, dans les prochains jours, d’une subvention pour mettre à niveau leurs établissements et assurer un redémarrage rapide de leur activité. L’enveloppe globale a été dédiée à hauteur de 90% aux EHT ayant été en activité en 2019, et 10% aux cas spéciaux n’ayant pas rempli cette condition. Dans la continuité de l’esprit de collaboration établi entre le ministère du tourisme et les professionnels du secteur, la mise en œuvre de ce mécanisme a fait l’objet d’une concertation continue et d’une implication étroite des hôteliers à travers la Confédération Nationale du Tourisme (CNT) et la Fédération Nationale de l’Industrie Hôtelière (FNIH) et ce durant toutes les phases de déploiement. A l’issue de l’opération d’instruction de l’ensemble des demandes d’appui, ces dernières ont été classées en fonction des résultats d’une évaluation multicritères par région et par catégorie, réalisée par des Comités Techniques locaux composés des délégués du Ministère du Tourisme, des représentants des AIH ainsi que des experts mandatés par la SMIT à cet effet. La répartition régionale des subventions allouées a été fixée en fonction de la capacité litière de chaque région. Pour les régions dont la somme des demandes de subvention n’a pas dépassé le budget alloué à la région, les demandes ont été satisfaites à 100%. Pour les autres régions, toutes les subventions ont été accordées selon une péréquation nationale permettant de répondre aux besoins de toutes les régions dans un esprit de solidarité. Par ailleurs, et pour encourager les petites structures, les demandes de subventions inférieures à 500 000 DH ont toutes été satisfaites à 100%. Pour rappel, un appel à manifestation d’intérêt (AMI) avait été lancé par la SMIT, le 21 février 2022, pour recenser les Établissements d’Hébergement Touristique souhaitant bénéficier de l’appui financier de l’État. Cet appel a eu un engouement considérable des opérateurs hôteliers à travers tout le territoire national et toutes catégories d’établissements confondues. Le nombre d’EHT bénéficiaires s’élève à 737 établissements ayant tous proposé des programmes d’investissement visant la préparation de la relance. Un deuxième AMI sera lancé au mois de juillet 2022 pour couvrir les demandes d’appui des EHT représentant les cas spéciaux.",2022-06-06,https://www.lavieeco.com/actualite-maroc/tourisme-fatim-zahra-ammor-active-loctroi-des-subventions-aux-etablissements-dhebergement/
"Tous les services et procédures de l’Etat seront disponibles en ligne à l’horizon 2030. A l’horizon 2030, tous les services et procédures de l’Etat seront disponibles en ligne et un pourcentage très élevé de citoyens auront recours à ces services en ligne. L’annonce a été faite, mercredi, par Mouhcine Yejjou, chef de programme Maroc EId à la DGSN. Présentant l’expérience de la DGSN en matière de protection des données personnelles, lors d’une rencontre internationale organisée en Tunisie, il a expliqué que dans ce modèle-là, le citoyen aura besoin d’un accès simple, rapide et sécurisé. Le recours à un service en ligne apportera ainsi au citoyen, estime le même responsable, un bénéfice en gain de temps, de transparence et d’accessibilité, qui ne doit pas être au détriment de la sécurité de ses transactions et de la protection de ses données personnelles. Le responsable a ajouté que le deuxième acteur de ce modèle, qui permettra de réduire les fraudes et les coûts, de promouvoir les services et d’instaurer une inclusion maximale. L’accent a été mis, en ce sens, sur les chantiers structurants lancés par le Maroc afin d’assurer la transition vers une « identité numérique complète », hautement sécurisée et intégrant les technologies modernes dans les documents d’identité. Cette transition peut contribuer à accélérer la transition numérique de l’administration publique dans le Royaume et permettre à tous les services publics et les acteurs privés de rapprocher leur bouquet de services du grand public. Conscient du rôle important que joue le digital dans le développement socioéconomique, le Maroc accorde un intérêt particulier à l’introduction des nouvelles technologies dans les différents écosystèmes publics et privés. Notre pays a pu durant les deux dernières décennies réaliser des avancées significatives en ciblant aussi bien l’administration, l’entreprise que la société. La dynamique enregistrée en matière de transition numérique s’est vue appuyée par les conclusions et recommandations du Nouveau Modèle de Développement qui a érigé le digital en tant que levier transverse pour assurer un développement responsable et inclusif. Catalyseur de transformations structurantes et à fort impact, le digital constitue un facteur clé pour améliorer le quotidien du citoyen et lui faciliter l’accès aux multiples services qu’offrent les acteurs et opérateurs socioéconomiques du pays. Dans le même ordre d’idées, le responsable a rappelé que la DGSN a remporté récemment l’«African Excellence Award E-Government» en reconnaissance du niveau avancé des prestations fournies par la nouvelle génération de la carte nationale d’identité électronique (CNIE 2.0), et du rôle important joué par ce document d’identité sécurisé pour assurer la sécurité des documents et des transactions à distance et le renforcement de la confiance dans l’identité numérique. Ce projet, faut-il le rappeler, est le fruit de plusieurs années de travail, l’aboutissement de plusieurs mois d’étude et de réflexions, de dizaines d’ateliers, pour le lancement de cette plateforme aujourd’hui. Il s’agit d’un produit qui bien qu’inspiré de plusieurs expériences internationales et de solutions existantes, est un modèle maroco-marocain, qui a été pensé et adapté aux caractéristiques et spécificités du Royaume et de son écosystème. Par ailleurs, le Royaume a connu en 2008 sa première carte nationale d’identité électronique (CNIE), bénéficiant à 32 millions de Marocains, dont 2,7 millions de MRE et couvrant plus de 85% de la population totale du Royaume. Ce document sera dorénavant la clé de voûte de tout le dispositif de digitalisation des procédures administratives et de transactions de tout genre. En effet, le renouvèlement des versions des CIN plusieurs fois au Maroc avait pour objectif d’améliorer la sécurité et la durabilité des titres, démocratiser le contrôle du document, accompagner le plan de développement numérique du Royaume, dématérialiser les documents et les procédures et répondre à la demande croissante sur les services en ligne, notamment ceux à grande valeur ajoutée, ainsi qu’instaurer une confiance générale dans les transactions numériques et physiques. La modernisation de cette plate-forme est motivée aussi par le contexte économique et sécuritaire lié notamment à l’économie numérique et aux enjeux de compétitivité pour les Etats, ainsi qu’au crime organisé, à la cybercriminalité et au terrorisme, et par le souci de protéger le citoyen et le rapprocher de l’administration avec de la transparence des transactions. En 2020, une nouvelle génération de titres identitaires a vu le jour. Il s’agit d’un document, à la pointe de la technologie, en plus de ses nouvelles caractéristiques physiques, introduit de nouveaux mécanismes qui donnent la possibilité d’exploiter de nouvelles fonctionnalités. Du coup, avec de tels mécanismes, supportés par la nouvelle carte, la DGSN, en tant que garante de l’identité régalienne des citoyens, et assurant son rôle historique de tiers de confiance pour les transactions physiques, a étendu ce rôle vers l’écosystème numérique en se positionnant en tant que tiers de confiance national pour l’identité, en en offrant à chaque citoyen une identité numérique, dérivée de son identité régalienne, et créer ainsi l’identité numérique régalienne. Il s’agit d’une identité numérique inclusive qui donne à tout un chacun la possibilité d’accéder facilement aux services en ligne et garantir la sécurité des transactions qui est au cœur de la conception de la plateforme. La protection des données personnelles est respectée sur toute la chaîne de traitement avec la demande systématique du consentement de l’utilisateur. En définitive, il est question de mettre en relation fournisseurs de services et citoyens à travers le tiers de confiance. Le citoyen pourra ainsi via une identification unique se connecter à tous les services disponibles d’une façon sécurisée. Pour accélérer le processus, 10 000 fonctionnaires seront formés La ministre de la transition numérique et de la réforme de l’administration, Ghita Mezzour, a tenu, récemment, une réunion avec les secrétaires généraux des ministères et directeurs généraux des établissements publics, axée sur l’accélération de la transition numérique de l’administration. Cette réunion de travail a pour objectif de réunir l’ensemble des acteurs concernés pour harmoniser les différentes initiatives et de développer des projets ayant un impact direct sur le citoyen et l’entreprise, en plaçant l’usager au cœur des priorités. La réunion a été l’occasion de présenter aux secrétaires généraux des ministères et aux directeurs généraux des établissements publics, les grandes orientations de la vision du ministère, afin d’harmoniser les différentes approches adoptées et de créer une synergie dans les projets de digitalisation des services administratifs, en s’appuyant sur les expériences réussies au Maroc et à l’international. Cette rencontre vise également à répondre de manière adéquate aux attentes des Marocains, en simplifiant davantage le parcours de l’usager, en renforçant les liens de confiance entre l’administration et le citoyen, et en améliorant la qualité des services qui lui sont offerts. Le renforcement du mouvement de la transition numérique passe par une nouvelle approche de collaboration holistique, consolidée, synchronisée et centrée sur l’usager, tout en assurant la continuité des chantiers déjà réalisés. A ce propos, de nombreuses actions pour mettre en œuvre la loi 55.19 ont été menées par le ministère. Un total de 3 832 procédures relevant de la compétence des administrations publiques ont été examinées, dont 2 700 sont publiées sur le site (Idarati.ma) et 800 ont été retirées car sans fondement juridique. Le chantier de la digitalisation des services administratifs s’appuie également sur la formation continue des fonctionnaires. A cet effet, le ministère a lancé un programme de renforcement des compétences des fonctionnaires en matière de digitalisation, qui vise 10 000 personnes au niveau central et local. Dans le même cadre, plus de 2 000 administrations dans le Royaume bénéficient de modules applicatifs développés par l’Agence de développement du digital (ADD), qui est pleinement engagée dans la transformation digitale de l’administration, à travers son volet (Smart Gouvernement), sous tutelle du département de la Transition numérique et de la réforme de l’administration.",2022-06-05,https://www.lavieeco.com/economie/transition-numerique-le-tout-digital-cest-pour-2030/
