text,date,link
"Ryad Mezzour, Ministre de l’Industrie et du commerce , était l’invité du plateau de l’émission « Décryptage » du dimanche 29 mai, sur la radio MFM. Couverture médicale, situation des petits commerçants, préférence nationale, hausse des prix des matières premières et énergétiques, … autant de sujets brûlants sur lesquels le ministre a réagi sans langue de bois, réitérant l’engagement du gouvernement à l’amélioration du pouvoir d’achat du consommateur marocain. Sur la situation des commerçants au Maroc, qui peinent à joindre les deux bouts et à se réinventer, le Ministre a appelé à une véritable mobilisation pour sauver les commerces de proximité qui subissent une concurrence rude de la part des enseignes de grande distribution. « Ces enseignes (étrangères) s’approvisionnent auprès des fournisseurs à des prix d’achat plus avantageux que les petits commerçants », a-t-il précisé. Selon le ministre, les petits commerçants doivent disposer de plus de liquidités pour faire face au changement et pouvoir se réinventer, préconisant le recours au crédit et aux organismes de financement. Le Ministre a déclaré par ailleurs que le chantier de la généralisation de la couverture médicale était « sur la bonne voie » et qu’environ 70% des commerçants y ont adhéré, soulevant les difficultés inhérentes à sa mise en œuvre, à l’instar de l’intégration des Ramédistes dans le régime de l’AMO. Lire aussi | La DGSN primée de l’ « African Excellence Award E-government » Le Ministre a rappelé que la priorité numéro 1 du gouvernement actuel est la création de postes d’emploi. « Aujourd’hui, le gouvernement est mobilisé pour la création d’emplois. C’est notre objectif ultime. Tout le monde attend de nous que l’on crée plus d’opportunités d’emplois pour les jeunes. Il faut profiter des opportunités géostratégiques qui s’offrent à nous aujourd’hui pour créer davantage d’emplois », a-t-il souligné. En ce qui concerne l’industrie, Ryad Mezzour a déclaré que son ministère est concerné par plus de 940 projets industriels d’un investissement de 40 MMDH, dont 40% proviennent des CRI. « Globalement, le service rendu par les CRI s’est considérablement amélioré », estime ainsi le Ministre. Selon lui, l’industrie marocaine a emprunté la voie de l’innovation et de la compétitivité, fournissant des produits de plus en plus sophistiqués et d’une qualité répondant aux standards internationaux. Lire aussi | Le fonds Cap Mezzanine I cherche repreneur à sa part dans le réseau Marwa « Le tissu économique national ne pouvait répondre il y a 10 ou 15 ans aux besoins du marché local, le Maroc s’était par conséquent orienté vers le produit extérieur pour répondre à une demande grandissante. Aujourd’hui, la production marocaine s’est considérablement développée au point de devenir compétitive à l’échelle internationale, et d’une qualité répondant également aux standards internationaux », a-t-il déclaré. Encore faut-il encourager le made in morocco : « la préférence nationale est importante. Il faut opérer un changement de mentalité et voir aujourd’hui le produit marocain d’un regard nouveau. », a-t-il poursuit. En ce qui concerne la hausse des prix des matières premières et des produits énergétiques, le ministre a relevé que les choix gouvernementaux ont pour but de préserver le pouvoir d’achat des marocains. « Ce qui est essentiel, c’est que les matières de consommation subissent la moindre augmentation possible, chose que nous sommes en train de réussir mieux que plusieurs autres pays. L’essentiel c’est de garder le contrôle de l’inflation pour pouvoir agir sur le pouvoir d’achat des consommateurs. » Lire aussi | IT. L’américain Holberton envisage d’ouvrir un campus au Maroc Ci-dessous le lien pour revoir l’intégralité de l’échange sur la page Youtube de MFM Radio :",2022-05-30,https://www.challenge.ma/ryad-mezzour-notre-priorite-est-la-creation-demplois-239603/
"L’Administration des Douanes et Impôts Indirects (ADII) a publié, vendredi, la circulaire n°6328/222 relative à l’entrée en vigueur de l’Accord amendant l’Accord de libre-échange Maroc-Turquie. « Le service est informé que, par lettre du 29 avril 2022 citée en référence, le Ministère des Affaires Etrangères, de la Coopération Africaine et des Marocains Résidant à l’Étranger a notifié à cette Administration l’entrée en vigueur, à compter du 28 avril 2022, de l’Accord portant amendement de l’Accord de libre-échange Maroc-Turquie, signé à Rabat le 24 août 2020 », indique l’ADII dans cette circulaire. Lire aussi | Le Maroc élu au Conseil exécutif de l’OMS pour la période 2022-2025 La circulaire n°6319/222 du 29 avril 2022 est ainsi modifiée en conséquence, fait savoir la même source, ajoutant que toute difficulté d’application sera signalée à l’Administration centrale sous le timbre de la présente. Lire aussi | Services d’architecte. Des pratiques anticoncurrentielles relevées par le Conseil de la concurrence",2022-05-27,https://www.challenge.ma/accord-de-libre-echange-maroc-turquie-ladii-publie-une-circulaire-239455/
"Selon le ministre délégué chargé du Budget, Fouzi Lekjaa, les céréales, les produits énergétiques et les produits de base importés, qui sont inclus dans les achats des entreprises marocaines sur le marché national, sont disponibles. Fouzi Lekjaa a présenté, à l’issue du Conseil de gouvernement tenu le 26 mai, des données sur l’importation de ces produits à la lumière de la conjoncture économique marquée par la crise sanitaire, ainsi que sur les mesures prises pour la préservation du pouvoir d’achat du citoyen, confirmant la disponibilité des céréales, des produits énergétiques et des produits de base importés. Lire aussi | La tutelle accélère la généralisation de la couverture médicale au profit des agriculteurs Il a expliqué que la hausse des prix est due à l’augmentation du coût du transport des marchandises, ajoutant que la gestion de cette crise nécessite de déployer des efforts continus pour garantir la disponibilité de tous les produits, notamment ceux de première nécessité pour l’ensemble des citoyens.Par ailleurs, Fouzi Lekjaa a fait observer que la maitrise du taux d’inflation et son maintien à des niveaux limités requiert une politique budgétaire et une politique monétaire basées sur le suivi quotidien, ajoutant que le taux d’inflation a atteint 4,1% à fin avril dernier, alors que les taux d’inflation dans les pays de la région oscillent entre 6,5% et 7% et s’élèvent à 6,1% en Europe. Lire aussi | Le port Tanger-Med occupe la 6ème position au monde en terme de performances [Banque mondiale]",2022-05-27,https://www.challenge.ma/inflation-fouzi-lekjaa-rassure-239431/
"La production de phosphates a enregistré un repli de 11% au premier trimestre 2022, contre une hausse de 6,6% au cours de la même période de l’année précédente, selon la Direction du Trésor et des Finances extérieures (DTFE), relevant du ministère de l’Economie et des Finances. De même, la production des dérivés de phosphates s’est contractée de 4,6%, contre +6,4% un an auparavant, sous l’effet de la baisse de 7,6% de la production de l’acide phosphorique et de 2,7% de celle des engrais naturels et chimiques, indique la DTFE dans sa récente note de conjoncture. « Cette contreperformance devrait s’atténuer au cours des prochains mois, en raison de la baisse de l’offre mondiale après la décision de la Russie de suspendre ses exportations d’engrais », prévoit la même source. Lire aussi | Voici les recommandations du CESE pour la transition vers une économie circulaire Et de rappeler que le chiffre d’affaires du groupe OCP a atteint 25,3 milliards de dirhams (MMDH) au T1-22, en hausse de 77% par rapport à la même période de l’année précédente. Cette performance a été portée par la hausse des prix de vente dans toutes les catégories de produits, qui a largement compensé la baisse des volumes de ventes. En effet, le conflit russo-ukrainien a intensifié la situation tendue en termes d’équilibre offre/demande sur le marché des phosphates et a entraîné une nouvelle hausse des prix, qui a également été accompagnée par l’augmentation des coûts des matières premières, en particulier l’ammoniaque et le soufre. Lire aussi | Rabat. Ouverture imminente du parking souterrain Bab El Had En termes de perspectives, le Groupe estime que la hausse des prix devrait se poursuivre sur l’année, soutenue par des conditions de marché solides, reflétant une forte demande globale, une situation tendue de l’offre et des prix de matières premières en hausse. Ainsi, une augmentation de 10% des volumes de production est prévue en vue de répondre à la demande des marchés à forte croissance, estime la même source.",2022-05-26,https://www.challenge.ma/phosphate-repli-de-11-de-la-production-au-premier-trimestre-2022-239396/
"Le président du Conseil économique, social et environnemental (CESE), Ahmed Réda Chami a appelé, mercredi à Rabat, à mettre en place une stratégie nationale pour la transition vers une économie circulaire. « Au vu des opportunités économiques, sociales et environnementales offertes par ce nouveau mode économique dans lequel les déchets des uns deviennent des ressources pour les autres, il importe d’adopter une stratégie visant la transition vers une économie circulaire », a dit M. Chami lors d’un atelier de restitution dédié à la présentation de l’avis du Conseil intitulé « Auto-saisine: l’économie circulaire au Maroc – appliquée aux ressources déchets ménagers et eaux usées ». Le président du Conseil a fait savoir que le modèle actuel de production et de consommation engendre de graves conséquences sur l’environnement et la qualité de vie, en particulier dans les domaines des déchets ménagers et des eaux usées, occasionnant l’épuisement des ressources naturelles, la pollution et l’accumulation des déchets. Et d’ajouter que cela impacte négativement la durabilité de la croissance économique. Lire aussi | Rabat. Ouverture imminente du parking souterrain Bab El Had Voici en quatre points clés les recommandations du Conseil Economique, Social et Environnemental (CESE) pour la transition vers une économie circulaire : Élaborer une loi-cadre relative à l’économie circulaire et une loi anti-gaspillage, et veiller à réorienter et réviser les lois déjà existantes pour in fine évoluer d’une économie de fonctionnement linéaire à une économie circulaire; Créer une instance au sein du ministère chargé de l’investissement, de la convergence et de l’évaluation des politiques publiques qui sera chargée de la coordination entre toutes les parties prenantes dans le sens d’assurer une déclinaison optimale de cette stratégie, selon une approche sectorielle et un déploiement territorialisé; Accélérer la mise en place de la « responsabilité élargie du producteur » (REP) et veiller à son application sur le terrain, en vue de permettre la mise en œuvre du principe du pollueur-payeur, le transfert, aux producteurs, de la responsabilité de l’organisation et du financement de la collecte et du traitement des déchets générés par leurs activités, ainsi que l’interdiction de certains polluants graves et la taxation d’autres polluants non-recyclables pour les rendre économiquement moins compétitifs pour les producteurs; Lire aussi | Le Maroc et la Hongrie souhaitent renforcer davantage leur partenariat économique En quatrième lieu, le CESE recommande de conditionner, dans une certaine mesure, les appuis de l’Etat accordés aux territoires et aux secteurs, aux efforts déployés en matière de circularité. Déchets ménagers : Réviser les contrats de gestion actuels conclus entre les collectivités, les sociétés de développement local et les sociétés privées, en y intégrant la valorisation des déchets (au lieu de leur mise en dépôt, leur enfouissement ou leur incinération); Fixer pour les territoires des objectifs engageant de réduction de la mise en décharge des déchets. Lire aussi | La Journée mondiale de l’Afrique célébrée ce mercredi 25 mai Eaux usées : Revoir les choix stratégiques qui ont privilégié l’investissement dans la mobilisation de la ressource hydrique (barrages et dessalement) en y intégrant la réutilisation des eaux usées et du stockage des eaux pluviales; Fixer des objectifs nationaux et territoriaux en termes de réutilisation des eaux usées qui engageraient toutes les parties prenantes, pollueurs et utilisateurs, en veillant à mettre en place le cadre réglementaire idoine; Rendre l’utilisation des eaux usées épurées compétitive en définissant le coût réel de l’eau selon ses différentes sources; Inscrire la réutilisation des eaux usées parmi les missions des futures « sociétés régionales multiservices » (SRM), avec l’obligation de prévoir, dès leur création, cet objectif dans leur business-plan.",2022-05-26,https://www.challenge.ma/voici-les-recommandations-du-cese-pour-la-transition-vers-une-economie-circulaire-239387/
"Le Groupe OCP, leader dans le domaine de la nutrition des plantes et premier producteur mondial d’engrais à base de phosphate, a annoncé avoir rejoint le World Economic Forum (WEF), organisation non-gouvernementale internationale, réputée pour sa conférence annuelle du Davos et se déroulant actuellement en Suisse. Ainsi, l’OCP renforce sa position d’acteur africain grâce à son partenariat avec le WEF, indique le groupe dans un communiqué, notant que les partenaires participent à des échanges intersectoriels et interrégionaux afin de comprendre les principales perturbations de leurs industries, de façonner la gouvernance environnementale et sociale et de mener des coalitions influentes. Lire aussi | La Banque mondiale accorde un prêt de 350 million de dollars au Maroc en appuie à l’économie bleue Au cours des deux dernières années, le WEF a renforcé ses actions à fort impact, abordant ainsi les sujets allant de la Covid-19 , du changement climatique à l’éducation en passant par la technologie et la gouvernance énergétique. En rejoignant le WEF, OCP participera aux discussions portant sur la coopération mondiale, le rééquilibrage économique, la société et l’équité, la nature, l’alimentation et le climat, la transformation de l’industrie et l’innovation, relève le communiqué, ajoutant que ce partenariat reflète l’approche et l’engagement du Groupe OCP à soutenir et à agir pour un avenir durable. Lire aussi | Rabat-Salé-Kénitra : de bonnes perspectives pour les cultures printanières S’imposant comme une tribune de confiance pour la coopération public-privé, le WEF fédère plus de 2.500 partenaires commerciaux mondiaux, gouvernements, institutions académiques de premier plan, jeunes leaders et organisations de la société civile pour s’attaquer aux problèmes mondiaux et trouver des solutions aux défis les plus urgents du monde, notamment la pandémie mondiale en cours, la guerre en Ukraine, les chocs géoéconomiques et le changement climatique.",2022-05-24,https://www.challenge.ma/le-groupe-ocp-rejoint-le-world-economic-forum-239309/
"La Banque mondiale vient d’approuver un prêt de 350 millions de dollars pour appuyer le lancement du programme Économie bleue au Maroc,, visant entre autres le développement l’investissement dans des domaines clés de l’économie bleue, notamment le tourisme durable et le sous-secteur de l’aquaculture. « Ce prêt entend stimuler la création d’emplois et la croissance économique, tout en améliorant la durabilité et la résilience des ressources naturelles, ainsi que la sécurité alimentaire, un enjeu dont l’importance s’est encore accentuée avec les répercussions de la guerre en Ukraine », indique l’institution financière internationale dans un communiqué publié à Washington. Le prêt a pour objectifs également de développer « des cadres institutionnels, améliorer la gestion intégrée des ressources naturelles et renforcer certains secteurs pour une économie bleue résiliente au changement climatique dans des zones ciblées », selon la même source. Lire aussi | La Chambre des représentants approuve le projet de loi relatif à l’organisation judiciaire « Bordé par la mer Méditerranée et l’océan Atlantique, le Maroc possède un fort potentiel de développement de l’économie bleue. Ses zones côtières représentent déjà plus de la moitié du PIB et des emplois du pays, alors qu’un plus grand potentiel demeure inexploité dans les filières bleues établies et naissantes, comme l’aquaculture, l’algoculture et les énergies marines renouvelables », relève le directeur des opérations de la Banque mondiale pour le Maghreb, Jesko Hentschel. Et Hentschel de citer le diagnostic établi dans le Nouveau modèle de développement qui souligne que le Maroc a la possibilité de développer des « clusters côtiers » qui attirent les investissements et créent des emplois, tout en assurant un développement durable . Le nouveau projet comprend, précise-t-on, deux volets. Le premier, qui s’articule autour d’une commission interministérielle et de mécanismes de coordination régionale, soutient l’établissement de cadres institutionnels visant à « renforcer la coordination verticale et horizontale ». Lire aussi | Maroc. Smurfit Kappa investit 35 millions d’euros pour son premier projet en Afrique Le second volet porte sur l’investissement dans des domaines clés de l’économie bleue, notamment le tourisme durable et le sous-secteur de l’aquaculture ; la formation professionnelle dédiée à la gestion de l’économie bleue ; la protection et la gestion des services écosystémiques ; et l’amélioration de la résilience climatique dans des zones ciblées. La création d’emplois et la croissance économique qui en découlent devraient stimuler la reprise après la pandémie de COVID-19, indique la Banque mondiale. « Fort de ses abondantes ressources marines et côtières, le littoral marocain offre, au sortir de la pandémie, des perspectives d’emplois et de reprise équitable, et une plus grande résilience face au changement climatique », indique Marcelo Hector Acerbi, spécialiste senior de l’environnement et responsable du projet, rappelant que le Maroc s’emploie à créer « une société plus verte, plus résiliente et plus inclusive ».",2022-05-24,https://www.challenge.ma/la-banque-mondiale-accorde-un-pret-de-350-million-de-dollars-au-maroc-239305/
