text,date,link
"La première édition du « Huawei Morocco Intelligent Finance Summit » s’inscrit pleinement dans la perspective de Huawei d’accompagner ses clients et partenaires à développer ensemble une finance entièrement connectée et intelligente. Huawei Maroc a organisé, jeudi à Casablanca, la première édition du « Huawei Morocco Intelligent Finance Summit ». S’articulant autour du thème ""Accélérer la numérisation de la finance"", cet événement a réuni plus de 100 clients, partenaires et experts de la finance, venus d'institutions nationales et internationales, pour discuter des nouvelles tendances dans le développement de la finance numérique. Animée par un panel d’éminents intervenants, la conférence s’est articulée autour de quatre axes importants: Stratégies, Affaires, Technologies et Ecosystèmes. L'événement a servi de plateforme d'échange d'expériences et de connaissances entre les professionnels en matière de finance numérique et intelligente. En axant leur attention sur les nouveaux défis auxquels est confronté le monde des services financiers à l'ère de l'économie numérique, l’ensemble des participants ont fait part de leurs pratiques réussies et de leurs initiatives de transformation numérique en vue d'une finance intelligente. « Alors que les industries se modernisent et convergent, le secteur des services financiers est lui-même en pleine transformation - avec des opérations qui se déplacent vers le cloud - alimenté par un écosystème d'appareils connectés, construit pour tous les scénarios. Dans cet environnement, Huawei s’engage à accélérer la transformation intelligente et inclusive des services financiers et à forger un écosystème ouvert de services bancaires intelligents intégrant la finance avec la technologie », a déclaré à cette occasion Nicolas Yuanyu, directeur Huawei Méditerranéen, Enterprise Business Group. Pour sa part, le vice-président Cloud & AI Africa chez Huawei, Mounir Soussi, a mis en exergue le positionnement de Huawei en tant que fournisseur de solutions Cloud agiles et intelligentes de premier plan au service du secteur financier. « Huawei se veut un partenaire stratégique de la transformation numérique du secteur financier. Fort de son expertise et de ses dernières innovations, Huawei accompagne ses partenaires dans ce secteur clé afin de refaçonner leurs systèmes TIC fermés en plateformes cloud ouvertes, basées sur l'intelligence artificielle et leur permettre ainsi d’atteindre la finance intelligente », a-t-il indiqué. De son côté, l'Executive FSI Solution Manager, El Mehdi EL Jair, a souligné la nécessite pour les banques de se transformer vers la banque 4.0 : « Une banque capable aujourd’hui de faire face aux nouveaux challenges posés aux institutions financières traditionnelles que ça soit en termes d’arrivée de nouveaux compétiteurs tels que les BigTech ou le changement des habitudes de consommation de services financiers. Aujourd’hui, cette banque du future est une banque qui adopte de nouvelles technologies telles que le cloud, le BigData ou l’intelligence artificielle pour implémenter de nouveaux modèles d’affaire tels que le lifestyle finance ou l’Embedded finance ». Lors de ce rendez-vous incontournable de la finance intelligente, trois initiatives stratégiques de Huawei ont été annoncées. Elles visent à transformer les institutions financières en entreprises entièrement équipées et basées sur l'écosystème numérique. Il s'agit notamment d'encourager les institutions à adopter pleinement les stratégies cloud-native, pour accélérer la convergence numérique et intelligente, créant ainsi une plateforme véritablement agile ; d'approfondir la numérisation dans tous les scénarios industriels pour améliorer le transfert sûr et sécurisé des données, en libérant la valeur potentielle du big data et en faisant progresser l'inclusion financière ; et de promouvoir l'agrégation de différents produits SaaS (Software as a Service) afin de permettre de construire un écosystème ouvert pour tous les scénarios.",2022-05-27 00:00:00.000000,https://lematin.ma/express/2022/huawei-morocco-intelligent-finance-summit-finance-connectee-intelligente/376295.html
 ,2022-06-12 00:27:02.939398,https://lematin.ma/express/2022/26e-conference-gouverneurs-banques-centrales-pays-francophones-s-tenue-25-26-mai-rabat/376293.html
"Ils sont 320 candidats retenus pour la phase de pré-sélection parmi 3.500 porteurs de projets inscrits au Trophée Ana Maâk organisé par Attijariwafa bank. Après les phases de speechs devant le jury, ce sont 3 grands gagnants nationaux qui remportent les trophées en plus du programme d’accompagnement assuré par la banque. Attijariwafa bank consolide son soutien aux petites entreprises et aux porteurs de projets souhaitant se lancer dans l’aventure entrepreneuriale à travers la 3ème édition du concours « Les Trophées Ana Maâk ». Lancée en octobre dernier, cette 3ème édition a connu un véritable succès avec la participation de 3.500 porteurs de projets qui se sont inscrits sur la plateforme www.daralmoukawil.com, un record par rapport aux deux premières éditions. Les 320 candidats retenus lors de la phase de pré-sélection ont participé à la caravane régionale qui a démarré le 6 décembre 2021 dans la région de Laâyoune et qui a sillonné les 12 régions du Royaume en vue de récompenser 3 gagnants par région dans les villes de Dakhla, Guelmim, Agadir, Errachidia, Marrakech, Béni Mellal, Fès, Oujda, Tanger, Rabat et a fini sa tournée à Casablanca le 5 Janvier 2022. Les candidats ont ainsi eu à présenter leurs projets devant un jury composé d’acteurs incontournables de l’écosystème entrepreneurial régional (Centre Régional d’Investissement ; Tamwilcom ; Chambres de Commerce ; d’Industrie et de services ; Chambres d’Artisanat ; Chambres d’Agriculture ; etc). Pendant cette étape, Attijariwafa bank a récompensé les 3 finalistes de chaque région par une subvention financière selon leur classement. Les gagnants Gold de chaque région, ont participé à la grande finale nationale qui s’est tenue le 26 mai 2022 à Casablanca en présence du président directeur général du groupe Attijariwafa bank, Mohamed El Kettani. Lors de cette finale, un éminent jury a désigné les 3 grands gagnants nationaux « Des Trophées Ana Maâk » qui ont reçu un prix additionnel d’une valeur comprise entre 50.000 et 100.000 DH. En plus des contributions financières, Attijariwafa bank offrira aux gagnants de ce concours un accompagnement sur-mesure et dans la durée afin de les soutenir dans la pérennisation de leur activité ainsi qu’un référencement auprès de la Direction des Achats d’Attijariwafa bank. À ce titre, l’ensemble des gagnants régionaux et nationaux ont bénéficié d’un compte bancaire gratuit et d’un accompagnement via le dispositif Dar Al Moukawil. À travers cette initiative citoyenne, Attijariwafa bank entend contribuer à la promotion de l’entrepreneuriat au Maroc, notamment auprès des jeunes et des femmes qui constituent une richesse formidable pour notre pays et renforce davantage son positionnement dans l’accompagnement des porteurs de projets et des Très Petites Entreprises. Par ailleurs, avec %42 de parts de marché sur le crédit Intelak, %36 sur le crédit Relance et %37 sur le crédit Oxygène, Attijariwafa bank confirme son leadership dans la distribution des instruments de soutiens financiers de l’Etat en faveur des TPE et des porteurs de projets. Sur le volet du soutien non financier, Attijariwafa bank a accompagné plus de 180.000 TPE et porteurs de projets via le dispositif des centres Dar Al Moukawil dans toutes les régions du Maroc.",2022-05-26 00:00:00.000000,https://lematin.ma/express/2022/attijariwafa-bank-finalistes-3e-edition-trophees-ana-ak-devoiles/376280.html
"La Fédération des Industries de la conserve des produits agricoles du Maroc (FICOPAM) a tenu, mercredi 18 mai 2022, son assemblée générale élective à Bouskoura. Cette assemblée a été précédée par la réunion du conseil d’administration. «À l’issue des débats, M. Boubker Bouayad, représentant la société CAPREL, a été élu président fédéral pour un mandat couvrant la période 2022-2025», annonce un communiqué publié en cette occasion. Pour rappel, les élections des organes de gouvernance de la Fédération ont lieu tous les trois ans. Ont également été élus ou réélus, le vice-président, Driss Terrab Maskri, de la société DEPALIM, le trésorier, Mly Hassan Debbarh Mounir, de la société Cartier Saada, le vice-trésorier, Oussama Sebti, de la société Juice Nectar Partner (JNP), ainsi que le secrétaire général, Abdelmalek Lazrek, représentant la société SIOF. Plus ancienne fédération professionnelle agroalimentaire du Maroc, la FICOPAM, créée en 1967, regroupe plusieurs associations professionnelles représentant les industries de transformation des produits agricoles.",2022-05-23 00:00:00.000000,https://lematin.ma/express/2022/boubker-bouayad-elu-president-ficopam/376126.html
"La prise de participation majoritaire de AFMA dans le cabinet de courtage ivoirien ACR opéré en décembre 2021, a donné naissance le vendredi 20 mai au cabinet ACR-AFMA. ACR, Assureurs Conseil Réunis, cabinet créé en 1979 par Mamadou Kanté, est devenu ACR-AFMA lors d’une réception qui a eu lieu à Abidjan, en présence de S.E. Abdelmalek Kettani, Ambassadeur du Roi du Maroc à Abidjan, du Maire de la ville et de Farid Bensaïd, président d'AFMA. A travers cette prise de participation majoritaire, AFMA, leader du courtage en assurance au Maroc, affirme ses ambitions africaines et choisit la Côte d’Ivoire comme première implantation dans la région. AFMA ambitionne de faire d’ACR-AFMA un des leaders du courtage en assurance en Côte d’Ivoire, grâce notamment au savoir-faire que va apporter le courtier marocain et aux synergies commerciales qui seront créées entre les deux cabinets. Cette opération stratégique permettra d’accompagner les entreprises marocaines dans le conseil et la gestion de leurs risques en Côte d’Ivoire, et d’offrir aux entreprises ivoiriennes la qualité d’un service reconnu au niveau international et par de nombreuses certifications.",2022-05-23 00:00:00.000000,https://lematin.ma/express/2022/cabinet-acr-afma-cote-divoire-ne/376124.html
"L’AFD et CDG développement ont retenu comme axes de travail la décarbonation des zones d’activités de MEDZ, filiale de CDG Développement et le développement du système de santé et de l’offre de soins sur le territoire national. Dans le cadre du partenariat entre la Caisse de Dépôt et de Gestion du Maroc (CDG) et l’Agence Française de Développement (AFD), deux institutions pilotes de l’IDFC (International Development Finance Club), CDG Développement et l’AFD ont signé un protocole d’accord, à l’occasion de la visite à Rabat du directeur général de l’AFD, Rémy Rioux. Cet accord vise à contribuer à l’opérationnalisation du Nouveau Modèle de Développement (NMD), d’une part à travers la stratégie long terme bas carbone du Royaume du Maroc et d’autre part à travers la dimension sociale du NMD. Venant renforcer les acquis entre les deux Groupes, le protocole d’accord, signé entre CDG Développement et l’AFD, vise la promotion du modèle de développement durable et inclusif choisi par le Maroc dans son NMD. Deux axes communs de coopération ont été retenus : La décarbonation des zones d’activités de MEDZ, filiale de CDG Développement ; Le développement du système de santé et de l’offre de soins sur le territoire national. Au-delà de ce protocole, des Accords Spécifiques seront ultérieurement signés entre CDG Développement et l’AFD pour préciser les modalités concrètes de réalisation d’opérations en commun, indique la même source. Omar Elyazghi, DG de CDG Développement a indiqué à l’occasion que le groupe a initié des mesures de mitigation des impacts induits par l'activité de ses parcs d’activités économiques, notamment en matière de conception et de développement de nouveaux projets durables, d’efficacité énergétique dans les bâtiments et de gestion des eaux usées et des déchets. « Nous nous réjouissons de voir l’AFD prête à accompagner ces efforts d’investissement durables. Par ailleurs, dans le cadre du Plan Santé 2025, CDG Développement et l’AFD sont en capacité de mettre en œuvre des opérations communes visant le développement de l'offre hospitalière aux niveaux provincial et régional » précise le DG. De son côté, Mihoub Mezouaghi, directeur de la représentation de l’AFD au Maroc, souligne que « le Maroc est le premier partenaire de l’AFD, et nos engagements de 2017 à 2021 ont atteint 2,2 Milliards d’euros dont 85% est à co-bénéfice climat. Nous sommes prêts à appuyer les efforts de décarbonation de l’économie marocaine, à travers des projets concrets, et tout spécialement avec la CDG Développement. Nous appuierons en outre l’amélioration de l’offre de soins dans les territoires, éléments indispensables de leur résilience, au bénéfice des populations ».",2022-05-23 00:00:00.000000,https://lematin.ma/express/2022/decarbonation-soins-sante-lafd-cdg-developpement-signent-protocole-daccord/376116.html
"SPE Capital, société de capital-investissement axée sur l'Afrique et le Moyen-Orient, annonce la signature d’un accord pour un investissement en capital d’environ 330 millions de dirhams (environ 33 millions de dollars) pour l’acquisition, au travers de son fonds SPE AIF I, d’une participation majoritaire dans le groupe Outsourcia (« Outsourcia »), opérateur marocain leader de l’expérience client externalisée et des métiers de l’outsourcing. Dans le cadre de ce partenariat avec Outsourcia, SPE Capital prendra le relais d’AfricInvest, lequel aura accompagné le développement de la société depuis 2016 et contribué, tant sur le plan financier que stratégique, à la construction du groupe actuel, et accompagnera son dirigeant et fondateur, Youssef Chraïbi, ainsi que l’ensemble de l’équipe de management du groupe dans l’accélération de sa croissance organique et externe, avec pour objectif l’amélioration continue de son offre et le renforcement de sa présence internationale, précise un communiqué. Réagissant à cet accord, Youssef Chraïbi, PDG d’Outsourcia, a souligné que son groupe a pu, durant les cinq dernières années, continuer à déployer sa stratégie de croissance, axée sur une diversification géographique et sectorielle. « Avec le soutien d'AfricInvest, nous avons notamment réalisé des acquisitions stratégiques en France et à Madagascar. A présent, l’arrivée d'un fonds d’investissement géré par SPE Capital dans le tour de table du groupe devrait nous permettre d'ouvrir un nouveau chapitre de notre développement et d'accélérer notre croissance, organique et externe, tant en Europe qu’en Afrique. La culture entrepreneuriale de SPE Capital, sa vision et son expérience dans la région sont autant d’atouts pour continuer à mettre en œuvre notre stratégie « Acquire & Migrate » et consolider notre positionnement d’acteur marocain indépendant majeur dans les métiers de l’outsourcing (..)», indique M. Chraibi. De son côté, Stéphane Heuzé, Managing Partner chez SPE Capital, a déclaré : « nous sommes très fiers de ce partenariat ambitieux avec Youssef Chraïbi et son équipe de management, dont l’expertise reconnue dans les métiers de l’outsourcing ont permis à la société de connaître une trajectoire de croissance remarquable, et ce dans un secteur porteur, répondant aux besoins accrus d’externalisation de nombreuses fonctions mais également aux enjeux de l’accès à l’emploi sur le continent ». Outsourcia a été conseillé par Asafo & Co. SPE Capital a été accompagné par Gide (conseiller juridique), Deloitte (conseiller financier et fiscal), Ibis Consulting (conseiller ESG), et Matine Consulting (conseiller commercial). La clôture de la transaction sera sujette à la levée des conditions suspensives usuelles et devrait avoir lieu durant l'été.",2022-05-18 00:00:00.000000,https://lematin.ma/express/2022/spe-capital-acquiert-participation-majoritaire-groupe-outsourcia/375890.html
